<?xml version="1.0" encoding="UTF-8"?>
<!-- XML Sample Message of message hierarchy                                          -->
<!-- Message:             ADC PUR Contracts v1.0 Rev. 4                               -->
<!-- Transaction:         AA - Audit Data Collection Rev. 271                         -->
<!-- Datamodel:           Audit Data Collection Datamodel, version HEAD Rev. 347      -->
<!-- XML tagset used:     AdcsML                                                      -->
<!-- Generated at:        02-05-2021 16:04:23                                         -->
<!-- Generated using:     EC-Design 2.5.0 (http://www.ec-design.nl)                   -->
<!-- Generated by:        Jan Vrijenhoek (Digitect)                                   -->
<!-- Organisation:        Digitect B.V. (Digitect)                                    -->
<!-- NOTE:    This sample message was generated automatically: manual modifications will be lost -->
<AdcPurContracts xsi:schemaLocation="http://schemas.iso.org/AdcsML/Messages/AdcPurContracts-v1 AdcPurContracts.xsd"
		xmlns="http://schemas.iso.org/AdcsML/Messages/AdcPurContracts-v1"
		xmlns:xsi="http://www.w3.org/2001/XMLSchema-instance">
	<PurContr>
		<ContrId>C001</ContrId>
		<ContrNr>C123456789</ContrNr>
		<ContrTypNm>Short-term</ContrTypNm>
		<ContrBegDt>2020-02-01</ContrBegDt>
		<ContrEndDt>2020-02-29</ContrEndDt>
		<SuplAcntId>S00001</SuplAcntId>
		<PurOrgCd>BS001</PurOrgCd>
		<PurrId>E001</PurrId>
		<SetlMthdCd>SC1</SetlMthdCd>
		<PayTermCd>PT1</PayTermCd>
		<ContrTrCurCd>USD</ContrTrCurCd>
		<Stat>NEW</Stat>
		<Rmrk>New short term contract.</Rmrk>
		<Crea>
			<UserId>JD</UserId>
			<Dt>2020-03-02</Dt>
		</Crea>
		<Aprv>
			<UserId>JD</UserId>
		</Aprv>
		<BusSg>
			<BusSgCd>1234</BusSgCd>
		</BusSg>
	</PurContr>
</AdcPurContracts>
